{
  "schemaVersion": 1,
  "id": "SFX_WOOD_SPLIT",
  "eventType": "SFX",
  "triggerId": "OBJECT_PROCESSED",
  "spatialization": "World3D",
  "priority": 70,
  "concurrencyGroup": "WOOD_TOOLS",
  "maxConcurrentInstances": 6,
  "mixBus": "ToolsAndConstruction",
  "fallbackPolicy": "GenericPlaceholder",
  "accessibilitySignal": "AudioAndVisual",
  "mustNotMaskThreatAudio": true,
  "notes": "Logical sound cue ID only; triggerId maps to the committed gameplay event contract (currently EWorldCommittedEventType::ObjectProcessed); no sound asset is included."
}
